Category,Count,Genes
Below Threshold,273,"aag, abrB, adhB, arsB, arsR, bdbC, bdbD, cdaS, cgeA, cgeB, cgeC, cheC, cheD, cheW, cheY, citH, clpC, comGA, comGB, comGC, comGD, comGE, comGF, comGG, cotA, cotB, cotC, cotD, cotG, cotH, cotI, cotR, cotS, cotSA, cotU, cotV, cotW, csfB, csfG, csgA, ctpB, ctsR, cwlC, cwlD, cwlH, cwlJ, cydA, cydB, cydC, cydD, disA, divIB, divIC, dltA, dltB, dltC, dltD, dltE, epr, fabL, fin, flgB, flgC, flhA, flhB, flhG, fliE, fliG, fliJ, fliL, fliP, fliQ, fliR, fliZ, ftsE, ftsH, ftsX, gerAA, gerAB, gerAC, gerBB, gerBC, gerD, gerKA, gerKB, gerKC, gerPA, gerPB, gerPC, gerPD, gerPE, gerT, glgD, glnM, gpr, hprT, katX, ligD, lysA, lytH, mbl, mciZ, mcsA, mcsB, metS, murAA, mutM, mutY, nucB, pbpF, pbpG, pdeH, pdxT, phoA, polA, ptkA, ptpZ, putB, putC, putP, radA, sdpA, sdpB, sigD, skfA, skfB, skfC, skfE, skfF, skfG, skfH, spo0F, spoIIE, spoIIP, spoIIR, spoIIT, spoVAA, spoVAB, spoVAC, spoVAD, spoVAEA, spoVAEB, spoVAF, spoVT, sprB, spsA, sscA, sspC, sspD, sspF, sspG, sspJ, sspM, surC, swrD, tagV, tgl, tilS, tkmA, tuaB, tuaC, tuaD, tuaE, tuaF, tuaG, tuaH, txpA, uxaA, uxaB, xpaC, yaaN, yaaO, yabM, yabN, yabR, yabS, ybaK, ybxH, yckD, ydfS, ydgA, ydgB, yesK, yfhF, yfkQ, yfkR, yfkS, yfkT, yfmI, yfnD, yfnE, yfnF, yhjQ, yisZ, yitA, yitB, yjzB, ykaA, ykoS, ykoT, ykvP, ykvQ, ykzP, ykzQ, ykzR, yodH, yodI, yosX, yotB, yotC, yotD, yotE, yotF, yotG, yotH, yotI, yotJ, yotK, yotM, yoyE, ypfB, yphA, yppG, ypqA, yqcK, yqfQ, yqfX, yqfZ, yqhG, yqhH, yqhV, yqjB, yqjC, yqxA, yqxI, yqxJ, yraE, yraF, yrdR, yrkC, yrrL, yrzN, yrzO, ytcA, ytcB, ytcC, ytdA, yteA, yteV, ytlA, ytlC, ytlD, yurS, yusD, yusE, yusN, yusQ, yusR, yusS, yutC, yuzA, yuzM, yvdQ, yvyE, ywcH, ywnJ, ywrJ, ywzB, ywzH, yxbC, yxbD, yxeD, yxzF"
Common Genes,55,"abbA, ccpC, cgeD, comZ, cotE, dapA, divIVA, dnaA, dnaN, ftsY, gmk, kinC, mraY, murB, murG, phrA, rapA, sepF, sigG, splB, spoIIGA, spoVD, spoVE, sspB, sspE, stoA, surA, swrB, yerB, yerC, yhaX, yhcM, yhcN, yhfM, yizC, yjbA, yjcA, yjfA, yjmC, ykqA, ykvU, ylbB, ylbC, ylmD, ylmG, ymfJ, ymxH, yndA, yneF, ynzB, yobW, yodL, yodS, yozE, ypzA"
Mfd-,42,"accA, asd, comK, cotJA, dacF, exoA, exuR, fliF, fliK, fliM, fliY, glnH, ktrC, lonB, med, mmgE, mmgF, parA, parB, rok, sbp, sigA, sigF, sinI, sinR, spo0A, spoIIAA, spoIVFA, spoIVFB, yesJ, ylmE, yloC, ylxF, ylxX, ypjB, yppD, yppE, yqhP, yqxD, yrrD, yrzQ, yyaD"
Partial Threshold,102,"accD, arsC, bofC, ccpB, cgeE, chaA, cheA, cheB, cotF, cotJB, cotJC, cotM, cotQ, cotX, cotY, csbX, dapG, dnaG, exuT, flgD, flgE, flhF, fliH, fliI, gdh, gerBA, gerE, gerPF, gerW, glcU, glgA, glgB, glgC, glgP, glnP, glnQ, htrC, ispG, kamA, kinA, lplD, mmgA, mmgB, mmgC, mmgD, murE, oxdD, pbpI, pdaA, pdxS, pghL, racA, refZ, rocD, rocE, sigE, sleB, splA, spoIIAB, spoIIQ, spoIVB, spoIVCA, sspA, sspH, sspI, sspK, tepA, yetF, yfhD, yfhE, yfhP, yfhS, yfkD, yfmJ, yhbB, yhdB, yhjR, yisL, yitF, yitG, yjmD, ykzD, ykzE, ylaJ, ylmH, ylxW, ylyA, ymaG, yndD, yoaR, yozQ, ypzI, yqhQ, yqkF, yqzG, yraD, yraG, yrrS, yrzR, ytfI, ytzC, ytzL"
YB955,31,"cotP, cotT, cotZ, lytE, murD, remA, spoVK, sspL, sspN, sspO, sspP, uxuA, ydcA, ydcC, ydfR, yhcO, yhcQ, yhcV, yhfW, yisY, yjaV, ykuJ, ykuK, yndE, yndF, yodQ, yodR, yodT, yokU, ypzF, ypzG"
